{
  "event_id": 25,
  "event_uuid": "018f5d8a-03fb-7df0-8e36-64d7410cfe25",
  "correlation_id": "session-1",
  "causation_event_id": null,
  "type": "project.topic_declared",
  "actor_id": "agent-a",
  "source": "agent",
  "source_ref": "agent:codex:session-1",
  "payload": {
    "handle": "billing",
    "topic_key": "pricing"
  },
  "ts": "2026-09-21T20:48:43Z"
}
